{
  "$schema": "../project.schema.json",
  "id": "still",
  "title": "Still",
  "subtitle": "A private, local-first visual library for websites worth remembering.",
  "iconTone": "coral",
  "thumbnail": "/project-media/still/icon.png",
  "type": "desktop app",
  "model": "GPT-5.6 Sol",
  "sortOrder": 20,
  "dockOrder": 20,
  "story": "Still captures full-page website screenshots, extracts useful metadata, and organises everything into a searchable personal collection stored entirely on the Mac.",
  "screenshots": [
    "/project-media/still/still-preview.webp"
  ]
}
